{
  "id": "reinforced_leather_pants",
  "name": "Reinforced Leather Pants",
  "description": "Sturdy leather pants with reinforcements.",
  "type": "armor",
  "rarity": "rare",
  "stackable": false,
  "value": 480,
  "requirements": {
    "level": 34,
    "class": ["rogue"]
  },
  "equipmentSlot": "legs",
  "statBonuses": {
    "dexterity": 7,
    "vitality": 2
  },
  "combatStatBonuses": {
    "defense": 14,
    "speed": 10
  }
}

