{
  "id": "steel_dagger",
  "name": "Steel Dagger",
  "description": "A well-crafted steel dagger.",
  "type": "weapon",
  "rarity": "rare",
  "stackable": false,
  "value": 1100,
  "requirements": {
    "level": 31,
    "class": [
      "rogue"
    ]
  },
  "equipmentSlot": "weapon",
  "statBonuses": {
    "dexterity": 7,
    "luck": 2
  },
  "combatStatBonuses": {
    "attack": 15,
    "speed": 12,
    "criticalChance": 5
  }
}