{
  "id": "amulet_tier2_1",
  "name": "Amulet Tier 2 #1",
  "description": "An amulet from tier 2.",
  "type": "accessory",
  "rarity": "uncommon",
  "stackable": false,
  "value": 60,
  "requirements": {
    "level": 16
  },
  "equipmentSlot": "amulet",
  "statBonuses": {
    "intelligence": 3
  },
  "combatStatBonuses": {
    "magicAttack": 7,
    "mana": 30
  }
}