{
  "id": "iron_mace",
  "name": "Iron Mace",
  "description": "A reliable iron mace.",
  "type": "weapon",
  "rarity": "uncommon",
  "stackable": false,
  "value": 150,
  "requirements": {
    "level": 16,
    "class": [
      "warrior"
    ]
  },
  "equipmentSlot": "weapon",
  "statBonuses": {
    "strength": 4,
    "vitality": 1
  },
  "combatStatBonuses": {
    "attack": 13
  }
}