{
  "id": "arcane_boots",
  "name": "Arcane Boots",
  "description": "Boots enchanted with arcane power.",
  "type": "armor",
  "rarity": "rare",
  "stackable": false,
  "value": 480,
  "requirements": {
    "level": 35,
    "class": ["mage"]
  },
  "equipmentSlot": "boots",
  "statBonuses": {
    "intelligence": 6,
    "wisdom": 2
  },
  "combatStatBonuses": {
    "magicDefense": 18,
    "mana": 70
  }
}

