{
  "id": "legendary_amulet_2",
  "name": "Legendary Amulet #3",
  "description": "A legendary amulet.",
  "type": "accessory",
  "rarity": "legendary",
  "stackable": false,
  "value": 30000,
  "requirements": {
    "level": 86
  },
  "equipmentSlot": "amulet",
  "statBonuses": {
    "strength": 20
  },
  "combatStatBonuses": {
    "attack": 40
  }
}