{
  "id": "leather_boots",
  "name": "Leather Boots",
  "description": "Light boots for agile movement.",
  "type": "armor",
  "rarity": "common",
  "stackable": false,
  "value": 38,
  "requirements": {
    "level": 1,
    "class": ["rogue"]
  },
  "equipmentSlot": "boots",
  "statBonuses": {
    "dexterity": 2
  },
  "combatStatBonuses": {
    "defense": 4,
    "speed": 5
  }
}

