{
  "id": "steel_boots",
  "name": "Steel Boots",
  "description": "Sturdy steel boots.",
  "type": "armor",
  "rarity": "rare",
  "stackable": false,
  "value": 420,
  "requirements": {
    "level": 30,
    "class": ["warrior"]
  },
  "equipmentSlot": "boots",
  "statBonuses": {
    "vitality": 5
  },
  "combatStatBonuses": {
    "defense": 18
  }
}

