{
  "id": "gold_jewelry_set",
  "name": "Gold Jewelry Set",
  "description": "A luxurious set of gold jewelry with precious gems.",
  "type": "accessory",
  "rarity": "epic",
  "stackable": false,
  "value": 2000,
  "requirements": {
    "level": 60
  },
  "equipmentSlot": "amulet",
  "statBonuses": {
    "intelligence": 8,
    "wisdom": 5,
    "luck": 4
  },
  "combatStatBonuses": {
    "magicAttack": 25,
    "magicDefense": 15,
    "mana": 100
  }
}

