{
  "id": "copper_axe",
  "name": "Copper Axe",
  "description": "A basic axe forged from copper.",
  "type": "weapon",
  "rarity": "common",
  "stackable": false,
  "value": 50,
  "requirements": {
    "level": 1,
    "class": [
      "warrior"
    ]
  },
  "equipmentSlot": "weapon",
  "statBonuses": {
    "strength": 3,
    "vitality": 1
  },
  "combatStatBonuses": {
    "attack": 11
  }
}